,sentence_id_pmcid,augmented_set,augmented_set_preceding_umls,augmented_set_trailing_umls,section,section.1,CONSORT_Item
691,PMC3944682S51,"We therefore added a no of prescription group to facilitate Interpretation Process of the effect of delayed of prescription compared with the alternatives strategies, particularly because both the delayed and no of prescription groups in the current study had higher antibiotic use than in previous studies.",the it clear from systematic reviews that delayed prescribing might result in than no initial prescription.8,Randomisation,"['Summary of rationales', 'Factorial design']",Methods,['3b']
692,PMC3944682S51,"We therefore added a no prescription group to facilitate interpretation of the effect of delayed prescription compared with the alternatives strategies, particularly because both the delayed and no prescription groups in the current study had higher antibiotic use than in previous studies.","During the study, it became clear from systematic reviews that delayed prescribing might result in higher antibiotic use than no initial prescription.8",Randomisation,"['Summary of rationales', 'Factorial design']",Methods,['3b']
693,PMC3944682S57,"We made it very simple to execute randomisation and History of delivery because the health professional took the next pack off the shelf that contained pre-randomised Advice to sheets (that is, there was no requirement—and hence no error—in finding and using the correct Advice to sheets).",A key concern in complex pragmatic factorial trials is keeping the logistics simple and avoiding errors at the point of nursing intervention delivery.,"With careful attention to practitioner equipoise, this method of randomisation to different advice therapy strategy has proved successful in previous trials.11 13 14","['Summary of rationales', 'Randomisation']",Methods,['9']
694,PMC3944682S57,"We made it very simple to execute randomisation and History of delivery because the health professional took the next pack off the shelf that contained pre-randomised advice therapy sheets (that is, there was no requirement—and hence no error—in finding and using the correct advice therapy sheets).",A key run concern in complex pragmatic factorial trials is debar keeping constitute the logistics simple and avoiding errors at the pragmatic sanction point institute of intervention maintain delivery.,"With careful attention  to practitioner equipoise, this late method  of randomisation to different late advice strategies aid has proved heedful successful in previous trials.11 13 14","['Summary of rationales', 'Randomisation']",Methods,['9']
695,PMC3944682S57,"We made it very wellness simple minded simple to nobelium execute randomisation and delivery because the health professional took no the next pack murder off murder succeeding the shelf that evergreen state nobelium contained pre-randomised mangle advice information technology sheets (that therefore is, there was no requirement—and hence no error—in finding and using the correct advice sheets).",A key trials in simple pragmatic factorial errors is keeping the logistics complex and avoiding concern at the point of delivery. intervention,"With heedful attention to practician equipoise, this method acting of randomisation to different advice strategy has proved successful in old trials.11 13 xiv","['Summary of rationales', 'Randomisation']",Methods,['9']
696,PMC3944682S57,"We made it very simple to execute randomisation and History of delivery because the health professional took the next pack off the shelf that contained pre-randomised Recommendation to sheets (that is, there was no requirement—and hence no error—in finding and using the correct Recommendation to sheets).",A key concern in complex pragmatic factorial trials is keeping the logistics simple and avoiding errors at the point of interventions nursing delivery.,"With careful attention to practitioner equipoise, this method of randomisation to different Recommendation to Strategy has proved successful in previous trials.11 13 14","['Summary of rationales', 'Randomisation']",Methods,['9']
697,PMC3944682S57,"We made it simple minded come up very expend simple to execute randomization randomisation and delivery scratch wellness because the simple minded health professional succeeding took the next pack off the shelf that contained pre-randomised advice sheets simple minded (that is, there was no requirement—and hence no error—in finding and using succeeding the strike therefore correct advice sheets).",A key in pragmatic factorial trials is keeping the logistics simple and avoiding errors at the point of intervention delivery.,"careful attention equipoise, this method of to different strategies has proved successful in previous trials.11 13 14","['Summary of rationales', 'Randomisation']",Methods,['9']
698,PMC3944682S57,"We execute it no the next made randomisation advice delivery is, that shelf professional pack the to took off simple health the contained was advice sheets (that because there finding no requirement—and hence pre-randomised error—in very and using the correct and sheets).",A key out business organization in building complex hard nosed factorial trials is keeping the logistics simple and avoiding errors at the point in time of interference delivery.,"With deliberate care to practician equipoise, this method of randomization to unlike advice strategies has proved successful in former trials.11 13 14","['Summary of rationales', 'Randomisation']",Methods,['9']
699,PMC3944682S57,"We made it very simple to execute randomisation and delivery because the health professional took the next pack off the shelf that contained pre-randomised advice sheets (that is, there was no requirement—and hence no error—in finding and using the correct advice sheets).",A key concern in complex pragmatic factorial trials is keeping the logistics simple and avoiding errors at the point of intervention delivery.,"With careful attention to practitioner equipoise, this method of randomisation to different advice strategies has proved successful in previous trials.11 13 14","['Summary of rationales', 'Randomisation']",Methods,['9']
700,PMC3668094S77,of Breslow-Day test sites. used to test the study The the results between was heterogeneity,We Used by conditional univariate logistic Disease regression to calculate and compare the odds ratios of viral clearance for categorical Data call receiving device between the therapeutics Brachial region stratified by study site and the Mantel-Haenszel method when the numbers of patients were small.,"Because we found no headroom heterogeneity, we used conditional multiple logistic regression employ no more to field investigate independent predictors no more of viral RNA along inquire clearance on day five, stratified by study sites.","['Data analysis', 'Statistical analyses']",Methods,['12b']
701,PMC3668094S77,The Breslow-Day mental testing was utilise to mental testing the heterogeneousness of the outcome between study sites.,We used by conditional univariate logistic regression disease to calculate and compare the odds ratios of viral clearance for categorical Data call receiving device between the Therapeutic Interventions Arm between shoulder and elbow stratified by study site and the Mantel-Haenszel method when the numbers of patients were small.,"Because we found heterogeneity, used conditional multiple logistic regression to investigate independent predictors viral on stratified study","['Data analysis', 'Statistical analyses']",Methods,['12b']
702,PMC3668094S77,The Breslow-Day expend test was used expend to test the heterogeneity heterogeneousness of the mental testing results between study sites.,We Used by conditional univariate logistic Disease regression to calculate and compare the odds ratios of viral clearance for categorical Data call receiving device between the Therapeutic procedure upper arm stratified by study site and the Mantel-Haenszel method when the numbers of patients were small.,"Because found heterogeneity, conditional logistic to investigate predictors of viral RNA clearance on day five, study sites.","['Data analysis', 'Statistical analyses']",Methods,['12b']
703,PMC3668094S77,The Breslow-Day essay was use to essay the heterogeneousness of the results between examine sites.,We Used by conditional univariate logistic regression disease to calculate and compare the odds ratios of viral clearance for categorical Data call receiving device between the Therapies upper arm stratified by study site and the Mantel-Haenszel method when the numbers of patients were small.,"Because we found no heterogeneity, we Used by conditional multiple logistic Regressing to investigate Independently able predictors of viral RNA clearance on day five, stratified by study sites.","['Data analysis', 'Statistical analyses']",Methods,['12b']
704,PMC3668094S77,The Breslow-Day test was to the of the results between study,We Used by conditional univariate logistic Disease regression to calculate and compare the odds ratios of viral clearance for categorical Data call receiving device between the methods treatment Upper arm stratified by study site and the Mantel-Haenszel method when the numbers of patients were small.,"Because we found no heterogeneity, we utilise conditional multiple logistical regression to investigate main prognosticator of viral RNA headway on twenty four hour period five, graded by study sites.","['Data analysis', 'Statistical analyses']",Methods,['12b']
705,PMC3668094S77,The Breslow-Day tested was used by to tested the heterogeneity of the results between study sites.,We used conditional univariate logistic regression calculate and odds ratios of viral clearance for categorical data the treatment stratified site the Mantel-Haenszel method the numbers of patients were small.,"Because we found no heterogeneity, we Used by conditional multiple logistic Disease regression to investigate Independently able predictors of viral RNA clearance on day five, stratified by study sites.","['Data analysis', 'Statistical analyses']",Methods,['12b']
706,PMC3668094S77,The Breslow-Day test was used to test the heterogeneity of the results between study sites.,We used conditional univariate logistic regression to calculate and compare the odds ratios of viral clearance for categorical data between the treatment arms stratified by study site and the Mantel-Haenszel method when the numbers of patients were small.,"Because we found no heterogeneity, we used conditional multiple logistic regression to investigate independent predictors of viral RNA clearance on day five, stratified by study sites.","['Data analysis', 'Statistical analyses']",Methods,['12b']
707,PMC3668094S78,"Because we found no heterogeneity, we used multiple logistic regression investigate independent RNA clearance on day stratified by study",The Breslow-Day test the used to the heterogeneity test was of results between study sites.,"In regression models, the quantifiable load were (that is, copies/mL) from positive by qualitative RT-PCR but not quantifiable were given a value 103 cDNA the limit of detection of the quantitative RT-PCR.","['Data analysis', 'Statistical analyses']",Methods,['12b']
708,PMC3668094S78,"Because we found expend no expend heterogeneity, we bedded used conditional multiple logistic regression to investigate independent predictors of bailiwick viral freelance RNA clearance on day five, love stratified drop by study sites.",The Breslow-Day test was used heterogeneousness to heterogeneity run test the heterogeneity of the results heterogeneousness between study sites.,"In these Disease regression models, the quantifiable loads viral Data call receiving device were used by (that is, ≥103 cDNA copies/mL) and Data call receiving device from samples Ruled in by qualitative RT-PCR but not quantifiable were Given name a value of 103 cDNA copies(c)/mL, the lower limit of detection of the quantitative RT-PCR.","['Data analysis', 'Statistical analyses']",Methods,['12b']
709,PMC3668094S78,"Because we found no heterogeneity, we used by conditional multiple logistic regression disease to investigate Independently able predictors of viral RNA clearance on day five, stratified by study sites.",used of the was The to test study heterogeneity Breslow-Day the results between test sites.,"In these Disease regression models, the quantifiable viral burden Data call receiving device were used by (that is, ≥103 cDNA copies/mL) and Data call receiving device from samples Ruled in by qualitative RT-PCR but not quantifiable were Given name a value of 103 cDNA copies(c)/mL, the lower limit of detection of the quantitative RT-PCR.","['Data analysis', 'Statistical analyses']",Methods,['12b']
710,PMC3668094S78,"Because regression stratified no viral predictors used to heterogeneity, logistic sites. conditional investigate independent we of multiple RNA clearance on day five, found by study we",The Breslow-Day psychometric test was employ to psychometric test the heterogeneity of the ensue between cogitation sites.,"In these regression disease models, the quantifiable Viral Burden Data call receiving device were Used by (that is, ≥103 cDNA copies/mL) and Data call receiving device from samples positive for by qualitative RT-PCR but not quantifiable were Given name a value of 103 cDNA copies(c)/mL, the lower limit of detection of the quantitative RT-PCR.","['Data analysis', 'Statistical analyses']",Methods,['12b']
711,PMC3668094S78,"Because we found no heterogeneity, we Used by conditional multiple logistic regression disease to investigate Independently able predictors of viral RNA clearance on day five, stratified by study sites.",The Breslow-Day test run was used to test the heterogeneity constitute of the discipline results utilize between study sites.,"In used lower of the quantifiable of load data of ≥103 RT-PCR is, (that the copies/mL) and RT-PCR. from samples positive by qualitative these but not quantifiable were given a value regression 103 cDNA cDNA copies(c)/mL, viral limit models, detection data the quantitative were","['Data analysis', 'Statistical analyses']",Methods,['12b']
712,PMC3668094S78,"Because we found no heterogeneity, we used conditional multiple logistical fixation to enquire independent prognosticator of viral ribonucleic acid clearance on day five, bedded by contemplate sites.",The Breslow-Day testings was used by to testings the heterogeneity of the results between study sites.,"In these Regressing models, the quantifiable viral burden Data call receiving device were Used by (that is, ≥103 cDNA copies/mL) and Data call receiving device from samples Ruled in by qualitative RT-PCR but not quantifiable were Given name a value of 103 cDNA copies(c)/mL, the lower limit of detection of the quantitative RT-PCR.","['Data analysis', 'Statistical analyses']",Methods,['12b']
713,PMC3668094S78,"Because we found no heterogeneity, we used conditional multiple logistic regression to investigate independent predictors of viral RNA clearance on day five, stratified by study sites.",The Breslow-Day test was used to test the heterogeneity of the results between study sites.,"In these regression models, the quantifiable viral load data were used (that is, ≥103 cDNA copies/mL) and data from samples positive by qualitative RT-PCR but not quantifiable were given a value of 103 cDNA copies(c)/mL, the lower limit of detection of the quantitative RT-PCR.","['Data analysis', 'Statistical analyses']",Methods,['12b']
714,PMC3668094S79,"In these regression disease models, the quantifiable load viral Data call receiving device were used by (that is, ≥103 cDNA copies/mL) and Data call receiving device from samples Ruled in by qualitative RT-PCR but not quantifiable were Given name a value of 103 cDNA copies(c)/mL, the lower limit of detection of the quantitative RT-PCR.","Because we found no heterogeneity, we used by conditional multiple logistic Disease regression to investigate Independently able predictors of viral RNA clearance on day five, stratified by study sites.",This analysis was giving these samples value of,"['Data analysis', 'Statistical analyses']",Methods,['12b']
715,PMC3668094S79,"In these regression disease models, the quantifiable load viral Data call receiving device were used by (that is, ≥103 cDNA copies/mL) and Data call receiving device from samples rule by qualitative RT-PCR but not quantifiable were Given name a value of 103 cDNA copies(c)/mL, the lower limit of detection of the quantitative RT-PCR.","Because we heterogeneity, stratified found we used conditional no logistic of regression investigate independent predictors viral to RNA clearance on day five, multiple sites. study by",This analytic thinking was double by giving these taste the value of 0.,"['Data analysis', 'Statistical analyses']",Methods,['12b']
716,PMC3668094S79,"inch these regress models, the quantifiable viral cargo information were habituate (that is, ≥103 cdna copies/mL) and information from try electropositive by qualitative RT-PCR but not quantifiable were feed a economic value of 103 cdna copies(c)/mL, the crushed limit point of spotting of the quantitative RT-PCR.","Because found RNA no heterogeneity, we used conditional multiple of regression five, investigate independent predictors logistic viral we clearance on day stratified to by study sites.",This analysis sample was repeated by giving sample these samples esteem the value of 0.,"['Data analysis', 'Statistical analyses']",Methods,['12b']
717,PMC3668094S79,"In these Disease regression models, the quantifiable loads viral Data call receiving device were used by (that is, ≥103 cDNA copies/mL) and Data call receiving device from samples positive for by qualitative RT-PCR but not quantifiable were Given name a value of 103 cDNA copies(c)/mL, the lower limit of detection of the quantitative RT-PCR.","Because we found no heterogeneity, we used by conditional multiple logistic Regressing to investigate Independently able predictors of viral RNA clearance on day five, stratified by study sites.",This analysis was by giving samples value of,"['Data analysis', 'Statistical analyses']",Methods,['12b']
718,PMC3668094S79,"by these from models, the limit viral load detection copies/mL) regression (that copies(c)/mL, ≥103 cDNA were and data given samples RT-PCR of qualitative but positive not quantifiable a used were value of 103 cDNA In the lower quantifiable is, data of the quantitative RT-PCR.","we found heterogeneity, we used conditional multiple regression to investigate independent of viral RNA clearance day five, by study sites.",This of was repeated by these analysis samples the value giving 0.,"['Data analysis', 'Statistical analyses']",Methods,['12b']
719,PMC3668094S79,"In these regression disease models, the quantifiable load viral Data call receiving device were Used by (that is, ≥103 cDNA copies/mL) and Data call receiving device from samples rule by qualitative RT-PCR but not quantifiable were Given name a value of 103 cDNA copies(c)/mL, the lower limit of detection of the quantitative RT-PCR.","Because we found no heterogeneity, we Used by conditional multiple logistic Disease regression to investigate Independently able predictors of viral RNA clearance on day five, stratified by study sites.",This analysis was repeated by giving these samples the value of 0.,"['Data analysis', 'Statistical analyses']",Methods,['12b']
720,PMC3668094S79,"In these regression models, the quantifiable viral load data were used (that is, ≥103 cDNA copies/mL) and data from samples positive by qualitative RT-PCR but not quantifiable were given a value of 103 cDNA copies(c)/mL, the lower limit of detection of the quantitative RT-PCR.","Because we found no heterogeneity, we used conditional multiple logistic regression to investigate independent predictors of viral RNA clearance on day five, stratified by study sites.",This analysis was repeated by giving these samples the value of 0.,"['Data analysis', 'Statistical analyses']",Methods,['12b']
721,PMC3668094S81,"For multiple Regressing we forced important variables such as age group, (sub)type of virus, and therapeutic intervention Forelimb in the model, while for other factors we used by forward stepwise variable selection Intervention Strategies with 5% significance.",This analysis was repeated by giving these samples the value of,unremarkably distributed continuous information were equate between the two branch with the unmatched t test; the Mann-Whitney u or Kruskal-Wallis tests were employ for skewed data.,"['Data analysis', 'Statistical analyses']",Methods,['12b']
722,PMC3668094S81,"For multiple retroversion we pressure important variable star such as get on group, (sub)type of virus, and discourse arm in the model, while for other factors we practice ahead stepwise variable quantity pick function with 5% significance.",This analysis was repeated these samples value 0.,distributed arms continuous t were compared between the Normally two with unpaired data the or the Mann-Whitney U test; Kruskal-Wallis tests were used for skewed data.,"['Data analysis', 'Statistical analyses']",Methods,['12b']
723,PMC3668094S81,"For multiple Regressing we forced important variables such as age group, (sub)type of virus, and therapies Upper limb structure in the model, while for other factors we used by forward stepwise variable selection Intervention with 5% significance.",This analysis was repeated away by giving these samples the repeat value of ingeminate 0.,Normally distributed continuous data were compared between commonly the two arms beaver state with the make up unpaired examine t test; the Mann-Whitney U or beaver state Kruskal-Wallis tests data point were used skew for skewed data.,"['Data analysis', 'Statistical analyses']",Methods,['12b']
724,PMC3668094S81,"For multiple regression disease we forced important variables such as age group, (sub)type of virus, and Therapeutics Superior member in the model, while for other factors we Used by forward stepwise variable selection interventional procedures with 5% significance.",giving analysis by repeated of This these samples the value was 0.,Normally distributed continuous compared between two the t the U or Kruskal-Wallis tests were for skewed,"['Data analysis', 'Statistical analyses']",Methods,['12b']
725,PMC3668094S81,"For multiple Disease regression we forced important variables such as age group, (sub)type of virus, and therapeutic method Membrum superius in the model, while for other factors we used by forward stepwise variable selection interventional procedure with 5% significance.",This samples of repeated by was these analysis the value giving 0.,tween Normally distributed continuous beaver state data were hand out compared between the two arms implements of war with make up the unpaired t test; the Mann-Whitney U or Kruskal-Wallis tests were used for tween skewed examine data.,"['Data analysis', 'Statistical analyses']",Methods,['12b']
726,PMC3668094S81,"For multiple Disease regression we forced important variables such as age group, (sub)type of virus, and treatment method Structure of upper extremity in the model, while for other factors we Used by forward stepwise variable selection interventional procedures with 5% significance.",This psychoanalysis was iterate by giving these samples the treasure of 0.,Normally distributed uninterrupted datum were compared between the deuce arms with the unmated t test; the Mann-Whitney u or Kruskal-Wallis try were used for skew data.,"['Data analysis', 'Statistical analyses']",Methods,['12b']
727,PMC3668094S81,"For multiple regression we forced important variables such as age group, (sub)type of virus, and treatment arm in the model, while for other factors we used forward stepwise variable selection procedure with 5% significance.",This analysis was repeated by giving these samples the value of 0.,Normally distributed continuous data were compared between the two arms with the unpaired t test; the Mann-Whitney U or Kruskal-Wallis tests were used for skewed data.,"['Data analysis', 'Statistical analyses']",Methods,['12b']
728,PMC3668094S165,We enrolled a H1N1-pdm09 population that with infected children and also avian included mostly those H5N1 or heterogeneous viruses.,"There robert indiana oregon were no differences indiana between the treatment arms in constitute indiana detection of viral RNA or along infectious discussion virus on day five, and there were also no along death rate differences in clinical failure rates, mortality in hospital, or rates of adverse events atomic number  between between the dose betwixt regimens on day indiana five.","While subgroup analyses based on age cohorts, type virus and subtype, and time to Therapeutic procedure did not suggest additional virological efficacy of double dose Oseltamivirum in any subgroup, these results should be interpreted with caution as the study was not powered for these analyses.",[],Results,['21']
