,sentence_id_pmcid,augmented_set,augmented_set_preceding_umls,augmented_set_trailing_umls,section,section.1,CONSORT_Item
0,PMC4770816S58,the ceased if cardiovascular participant had Follow-up major a event.,"based practitioners actively of the trial, the general above had access to a computer In algorithm that was suggested drugs and target. if the participant arms both dosage",The and outcome was change primary in blood systolic between baseline pressure one year.,['Procedures'],Methods,['7b']
1,PMC4770816S58,Follow-up ceased if the participant a major event.,"do drugs player In reckoner both arms of the trial, the general practitioner practitioners had access to algorithmic rule a computer based algorithm that get at actively suggested drugs and dosage if do drugs the participant was found above target.",The primary outcome was change in sbp between baseline and one year.,['Procedures'],Methods,['7b']
2,PMC4770816S58,Follow-up give up if the player had a john major cardiovascular event.,"In both Proximal segment of free upper limb of the trial, the general practitioners had access to a computer based Calculated that actively suggested Medication and dosage if the participant was above target.",The primary outcome was change in blood pressure systolic between baseline and one year.,['Procedures'],Methods,['7b']
3,PMC4770816S58,follow up discontinue if the player had a major cardiovascular event.,"In both Brachiums of the trial, the general practitioners had access to a computer based Calculated that actively suggested Medication and dosage if the participant was above target.",The primary outcome was change in systolic blood pressure between baseline one,['Procedures'],Methods,['7b']
4,PMC4770816S58,Follow-up john r major ceased if player the participant had a followup major cardiovascular event.,"in both gird of the trial, the cosmopolitan practitioner had memory access to a computer based algorithm that actively intimate drugs and dose if the player was above target.",The primary outcome was change in Blood pressure systolic between baseline and one year.,['Procedures'],Methods,['7b']
5,PMC4770816S58,Follow-up ceased if the participant had a major cardiovascular event.,"In both Upper Arms of the trial, the general practitioners had access to a computer based Calculated that actively suggested MEDICATION and dosage if the participant was above target.",The elementary consequence was change in systolic blood atmospheric pressure between baseline and  year.,['Procedures'],Methods,['7b']
6,PMC4770816S58,Follow-up ceased if the participant had a major cardiovascular event.,"In both arms of the trial, the general practitioners had access to a computer based algorithm that actively suggested drugs and dosage if the participant was above target.",The primary outcome was change in systolic blood pressure between baseline and one year.,['Procedures'],Methods,['7b']
7,PMC4770816S75,"Subgroup analyses were pre-specified for DIABETES MELLITUS NON INSULIN DEPENDENT mellitus, Cardiac Atrium fibrillation, and age group.","We too explored the potential effects of lack values by the use of ternion approaches: multiple imputation, radical mean, and final stage uncommitted value.","by subgroup we did (<140 addition, analysis In baseline systolic blood pressure a Hg). mm ≥140 Hg, mm",['Statistical analysis'],Methods,['12b']
8,PMC4770816S75,"Subgroup analyses were pre-specified for noninsulin dependent diabetes mellitus mellitus, upper chambers of the heart fibrillation, and age group.","We also explored the potential value. by missing use and the values of three approaches: available imputation, effects mean, of last multiple group","answer In addition, we did a subgroup analysis by baseline service line millimeter service line systolic blood pressure (<140 millimeter mm Hg, ≥140 mm Hg).",['Statistical analysis'],Methods,['12b']
9,PMC4770816S75,"Subgroup analyses were fibrillation, for and pre-specified atrial mellitus, diabetes age group.","also explored effects of missing values the use of three group mean, and last available","by mm we did a subgroup analysis Hg, baseline systolic (<140 pressure blood addition, mm ≥140 In Hg).",['Statistical analysis'],Methods,['12b']
10,PMC4770816S75,"subgroup depth psychology were pre-specified for diabetes mellitus, atrial fibrillation, and senesce group.","also explored potential of missing by of three approaches: group mean, available value.","In addition, we did a subgroup analysis by baseline blood pressure systolic (<140 mm Hg, ≥140 mm Hg).",['Statistical analysis'],Methods,['12b']
11,PMC4770816S75,"Subgroup analyses were pre-specified for diabetes mellitus, and age group.","We also explored the potential effects of missing values by the use of three approaches: multiple imputation, group mean, and last available value.",In analysis systolic pressure (<140 mm ≥140 mm Hg).,['Statistical analysis'],Methods,['12b']
12,PMC4770816S75,"Subgroup analyses were personify pre-specified for diabetes subgroup mellitus, atrial be fibrillation, and age group.","We also approaches: values potential effects of missing the by explored use and three the multiple imputation, group mean, of last available value.","In addition, we did a subgroup analysis by baseline Systolic blood pressure measurement (<140 mm Hg, ≥140 mm Hg).",['Statistical analysis'],Methods,['12b']
13,PMC4770816S75,"Subgroup analyses were pre-specified for diabetes mellitus, atrial fibrillation, and age group.","We also explored the potential effects of missing values by the use of three approaches: multiple imputation, group mean, and last available value.","In addition, we did a subgroup analysis by baseline systolic blood pressure (<140 mm Hg, ≥140 mm Hg).",['Statistical analysis'],Methods,['12b']
14,PMC4770816S76,"In addition, we did a analysis systolic pressure (<140 mm Hg, ≥140 Hg).","analyses for diabetes atrial fibrillation, and age group.","We compared the number changes, and side effects by mixed modelling, adjusting for the same variables as in outcome.",['Statistical analysis'],Methods,['12b']
15,PMC4770816S76,"amp millimetre In addition, we insistence did millimetre a subgroup analysis by mm baseline systolic blood pressure (<140 mm Hg, ≥140 mm Hg).","Subgroup analyses were pre-specified for mellitus, diabetes atrial and fibrillation, group. age","We compared the event number of consultations, treatment changes, and side effects by using turn generalised variable mixed modelling, face victimization adjusting for the same variables as in the victimization conform primary outcome.",['Statistical analysis'],Methods,['12b']
16,PMC4770816S76,"In addition, we did a subgroup fare analysis by baseline systolic blood psychoanalysis millimetre pressure transportation (<140 mm Hg, ≥140 mm fare Hg).","Subgroup analyses were pre-specified for diabetes type 2 mellitus, Cardiac Atrium fibrillation, and age group.","We compared the number of consultations, therapy changes, and side effects by using generalised mixed modelling, adjusting for the same variables as in the primary outcome.",['Statistical analysis'],Methods,['12b']
17,PMC4770816S76,"In addition, we baseline analysis subgroup mm by did systolic a pressure Hg). blood Hg, ≥140 mm (<140","Subgroup analyses were pre-specified for diabetes mellitus, atrial group.","We compared the number of consultations, method treatment changes, and side effects by using generalised mixed modelling, adjusting for the same variables as in the primary outcome.",['Statistical analysis'],Methods,['12b']
18,PMC4770816S76,"In addition, we did a subgroup analysis by baseline Systolic blood pressure measurement (<140 mm Hg, ≥140 mm Hg).","Subgroup analyses were pre-specified for ketosis resistant diabetes mellitus, Atrium of heart fibrillation, and age group.","liken We event compared the number of consultations, treatment changes, and away side effects by using face generalised mixed modelling, adjusting for inch the same variables as in the conform compare primary outcome.",['Statistical analysis'],Methods,['12b']
19,PMC4770816S76,"In addition, we did a subgroup analysis by baseline Blood pressure systolic (<140 mm Hg, ≥140 mm Hg).","subgroup break down were pre-specified for diabetes mellitus, atrial fibrillation, and eld group.","We the consultations, treatment changes, effects by mixed modelling, for the as in the primary",['Statistical analysis'],Methods,['12b']
20,PMC4770816S76,"In addition, we did a subgroup analysis by baseline systolic blood pressure (<140 mm Hg, ≥140 mm Hg).","Subgroup analyses were pre-specified for diabetes mellitus, atrial fibrillation, and age group.","We compared the number of consultations, treatment changes, and side effects by using generalised mixed modelling, adjusting for the same variables as in the primary outcome.",['Statistical analysis'],Methods,['12b']
21,PMC4770816S77,"We compare the numerate of consultations, treatment changes, and side of meat effects by using generalised amalgamate modelling, aline for the same variable as in the elemental outcome.","In addition, we indiana service line millimetre did a subgroup analysis by baseline systolic blood millimetre pressure (<140 mm Hg, atmospheric pressure ≥140 mm Hg).","For clinical events, we calculated peril ratios and their 95% trust interval by using Cox relative jeopardy modelling, adapt for the same covariates note previously.",['Statistical analysis'],Methods,['12b']
22,PMC4770816S77,"We compared the number treatment and effects by using generalised modelling, adjusting the variables as in the outcome.","In addition, we did a subgroup analysis by baseline blood pressure systolic (<140 mm Hg, ≥140 mm Hg).","the clinical events, we modelling, 95% ratios for their hazard confidence intervals by using adjusting proportional hazards calculated Cox and For same covariates mentioned previously.",['Statistical analysis'],Methods,['12b']
23,PMC4770816S77,"We compared the number of consultations, Therapeutic changes, and side effects by using generalised mixed modelling, adjusting for the same variables as in the primary outcome.","In addition, we did a subgroup analysis by systolic blood pressure (<140 mm Hg, ≥140 mm Hg).","For clinical calculated ratios and their 95% confidence by using Cox proportional hazards modelling, for the same covariates mentioned previously.",['Statistical analysis'],Methods,['12b']
24,PMC4770816S77,"We compared the number of consultations, Therapeutic Technique changes, and side effects by using generalised mixed modelling, adjusting for the same variables as in the primary outcome.","In addition, we did a subgroup analysis by baseline Systolic blood pressure measurement (<140 mm Hg, ≥140 mm Hg).","For clinical events, we calculated hazard ratios and their 95% self confidence intervals by using cox microbiology subtype proportional hazards modelling, adjusting for the same covariates mentioned previously.",['Statistical analysis'],Methods,['12b']
25,PMC4770816S77,"We compared the number of burden consultations, treatment changes, and handling side effects by using load generalised mixed issue set amp modelling, adjusting for the same variables as in the side of meat primary outcome.","In addition, amp we did a subgroup analysis by baseline systolic blood pressure service line (<140 mm line of descent Hg, ≥140 mm line of descent indiana Hg).","For clinical events, we calculated hazard ratios and their 95% Self Confidence intervals by using cox microbiology subtype proportional hazards modelling, adjusting for the same covariates mentioned previously.",['Statistical analysis'],Methods,['12b']
26,PMC4770816S77,"We compared the number of consultations, method treatment changes, and side effects by using generalised mixed modelling, adjusting for the same variables as in the primary outcome.","blood addition, we Hg, a subgroup analysis by baseline Hg). (<140 did In mm pressure ≥140 mm systolic","For clinical bring up events, time interval we calculated hazard victimization ratios and their 95% time interval confidence intervals by using Cox proportional hazards modelling, bring up adjusting for the same self confidence covariates mentioned deliberate previously.",['Statistical analysis'],Methods,['12b']
27,PMC4770816S77,"We compared the number of consultations, treatment changes, and side effects by using generalised mixed modelling, adjusting for the same variables as in the primary outcome.","In addition, we did a subgroup analysis by baseline systolic blood pressure (<140 mm Hg, ≥140 mm Hg).","For clinical events, we calculated hazard ratios and their 95% confidence intervals by using Cox proportional hazards modelling, adjusting for the same covariates mentioned previously.",['Statistical analysis'],Methods,['12b']
28,PMC4770816S78,"For clinical events, we calculated hazard ratios and their 95% Self Confidence intervals by using Cox microbiology subtype proportional hazards modelling, adjusting for the same covariates mentioned previously.","We treatment changes, and side effects by using generalised mixed for the same variables as in primary outcome.",exemplary We checked the proportional hazard let in assumption with price Schoenfeld residual plots and by including interaction terms in the damage let in model (for balance each term by time).,['Statistical analysis'],Methods,['12b']
29,PMC4770816S78,"clinical events, we calculated hazard ratios and their 95% intervals using hazards adjusting for mentioned","We compared the changes, of in treatment using as side effects by primary generalised modelling, mixed adjusting for the number variables and consultations, the same outcome.",We checked the proportional hazard tick off assumption with damage Schoenfeld residual plots and by including interaction terms in price plot of ground the model balance (for condition each term by time).,['Statistical analysis'],Methods,['12b']
30,PMC4770816S78,"trust For clinical events, we calculated hazard ratios and their 95% past cyclooxygenase confidence lapplander intervals by using Cox name proportional set hazards modelling, adjusting past for the same covariates mentioned previously.","We compared the of consultations, treatment changes, and side effects by using mixed for same as in the",We checked hazard Schoenfeld residual plots by interaction terms in the model (for each term time).,['Statistical analysis'],Methods,['12b']
31,PMC4770816S78,"For clinical events, we calculated hazard ratios and their 95% Self Confidence intervals by using cox microbiology subtype proportional hazards modelling, adjusting for the same covariates mentioned previously.","We compared the number of consultations, Therapeutic Technique changes, and side effects by using generalised mixed modelling, adjusting for the same variables as in the primary outcome.",We checked with proportional hazard term the residual Schoenfeld plots interaction by each and (for in the model terms including assumption by time).,['Statistical analysis'],Methods,['12b']
32,PMC4770816S78,"modelling, clinical events, the calculated hazard by and we 95% confidence intervals ratios using Cox adjusting for For proportional mentioned their same covariates hazards previously.","We compared the number of consultations, therapeutics changes, and side effects by using generalised mixed modelling, adjusting for the same variables as in the primary outcome.",We mark off the relative hazard supposition with Schoenfeld residual plots and by including fundamental interaction terms in the manakin (for each terminal figure by time).,['Statistical analysis'],Methods,['12b']
33,PMC4770816S78,"For clinical events, we calculated hazard proportion and their 95% authority separation by using cyclooxygenase relative hazards modelling, correct for the same covariates remark previously.","We liken the issue of consultations, intervention changes, and side effects by utilise generalised mix in modelling, adjusting for the same variable as in the primary coil outcome.",We checked the proportional hazard assumption with Schoenfeld residual plots and by including Social Interaction terms in the Digital Model Attachment (for each term by time).,['Statistical analysis'],Methods,['12b']
34,PMC4770816S78,"For clinical events, we calculated hazard ratios and their 95% confidence intervals by using Cox proportional hazards modelling, adjusting for the same covariates mentioned previously.","We compared the number of consultations, treatment changes, and side effects by using generalised mixed modelling, adjusting for the same variables as in the primary outcome.",We checked the proportional hazard assumption with Schoenfeld residual plots and by including interaction terms in the model (for each term by time).,['Statistical analysis'],Methods,['12b']
35,PMC4770816S79,We checked the proportional hazard assumption with Schoenfeld residual plots and by including Interaction with others terms in the Digital Model Attachment (for each term by time).,"For clinical events, we calculated hazard ratios and their 95% Self Confidence intervals by using cox microbiology subtype proportional hazards modelling, adjusting for the same covariates mentioned previously.",all event censored patients at time of the first event to that analysis.,['Statistical analysis'],Methods,['12b']
36,PMC4770816S79,We hazard assumption with residual plots and by terms in model (for term by time).,"For clinical events, we calculated hazard ratios and their 95% Self Confidence intervals by using Cox microbiology subtype proportional hazards modelling, adjusting for the same covariates mentioned previously.","For all clinical event analyses, unit we censored patient role patients at the time of the first unit event unit relevant to whole that analysis.",['Statistical analysis'],Methods,['12b']
37,PMC4770816S79,checked hazard with Schoenfeld and including interaction in the model (for each term by time).,"For clinical events, we calculated hazard ratios and their 95% self confidence intervals by using cox microbiology subtype proportional hazards modelling, adjusting for the same covariates mentioned previously.","For all clinical analyses, we censored patients at the time of the relevant to analysis.",['Statistical analysis'],Methods,['12b']
38,PMC4770816S79,We checked the relative gamble assumption with Schoenfeld residual plots and by include fundamental interaction full term in the manakin (for each term by time).,"For clinical events, we calculated hazard ratios and their 95% self confidence intervals by using Cox microbiology subtype proportional hazards modelling, adjusting for the same covariates mentioned previously.","For that clinical time event we censored patients at the event of all first the relevant to analyses, analysis.",['Statistical analysis'],Methods,['12b']
39,PMC4770816S79,We checked the proportional hazard assumption with Schoenfeld residual plots and by including Social Interactions terms in the Digital Model Attachment (for each term by time).,"For adjust clinical events, we calculated hazard ratios and their 95% confidence authority intervals by using Cox line up proportional cox hazards modelling, adjusting proportion coxswain for authority the same covariates mentioned previously.","For all clinical event upshot analyses, atomic number  we censored patients at the time whole of the first event relevant censor to atomic number  that analysis.",['Statistical analysis'],Methods,['12b']
40,PMC4770816S79,We assure checked the proportional hazard assumption with Schoenfeld residual plots and by including exemplar interaction reassure terms in the model patch (for each august  damage term by time).,"For clinical events, we calculated chance ratio and their 95% sureness interval by using cyclooxygenase proportional hazards modelling, set for the same covariates observe previously.","For clinical first event analyses, we all patients at the time relevant the censored event to of that analysis.",['Statistical analysis'],Methods,['12b']
41,PMC4770816S79,We checked the proportional hazard assumption with Schoenfeld residual plots and by including interaction terms in the model (for each term by time).,"For clinical events, we calculated hazard ratios and their 95% confidence intervals by using Cox proportional hazards modelling, adjusting for the same covariates mentioned previously.","For all clinical event analyses, we censored patients at the time of the first event relevant to that analysis.",['Statistical analysis'],Methods,['12b']
42,PMC4770816S141,The population by a trial primary care population managed by generalists than rather a hospital/outpatient represents post-stroke managed selective specialists.,"It is likely, therefore, that the more intensifier point would have been eventide severe to reach if the trial population was more instance of citizenry with dominant cerebrovascular disease.","The outcome measure was not blinded, but a nurse not directly involved in the participant’s in care obtained it by using an automated sphygmomanometer, so systematic recording bias is unlikely.",['Strengths and weaknesses of study'],Discussion,['21']
43,PMC4770816S141,The trial represents a post-stroke Primary health care population managed by generalists rather than a selective hospital/outpatient population managed by specialists.,"It is likely, therefore, that knockout the more intensive target would have been even harder to achieve intensifier if more than constitute the trial knockout masses population was more more than representative of constitute people with prevalent cerebrovascular disease.","The outcome measure was not blinded, but a nurse not directly involved in the participant’s In care obtained it by using an automated sphygmomanometer, so systematic recording bias is unlikely.",['Strengths and weaknesses of study'],Discussion,['21']
44,PMC4770816S141,The trial represents a post-stroke primary health care population managed by generalists rather than a selective hospital/outpatient population managed by specialists.,"It is likely, therefore, that the would intensive target the achieve been even harder to cerebrovascular if with trial people of more representative disease. population more prevalent have was","give care merely The thence outcome measure was not blinded, but a nurse not but directly involved in the participant’s call for care obtained it by using an automated sphygmomanometer, make up receive so victimization systematic recording bias is unlikely.",['Strengths and weaknesses of study'],Discussion,['21']
45,PMC4770816S141,The trial pull off represents a sort of post-stroke primary care tryout test population managed by universe generalists rather than a pull off selective hospital/outpatient population managed by specialists.,"It is likely, fifty fifty therefore, that prevailing the spokesperson more intensive target would have been even constitute harder to achieve if the trial butt more than population institute was more representative of people with prevalent intensifier cerebrovascular disease.","The outcome measure information technology was not blinded, but receive a read nurse not directly involved in the participant’s care away obtained it by using an predetermine automated sphygmomanometer, predetermine so receive systematic recording bias is meet unlikely.",['Strengths and weaknesses of study'],Discussion,['21']
46,PMC4770816S141,represents a post-stroke care population generalists selective hospital/outpatient by specialists.,"information technology is likely, therefore, that the more intensifier butt would have been even arduous to attain if the trial universe was more representative of the great unwashed with predominant cerebrovascular disease.","The outcome measure was not a nurse not involved in the participant’s obtained by using automated sphygmomanometer, so systematic unlikely.",['Strengths and weaknesses of study'],Discussion,['21']
47,PMC4770816S141,trial a post-stroke primary population managed by generalists rather than a selective hospital/outpatient population managed by,"It likely, intensive target would been even harder achieve if the trial population representative of people with cerebrovascular disease.","The outcome measure was not blinded, but a nurse not directly involved in the participant’s care provided in residence obtained it by using an automated sphygmomanometer, so systematic recording bias is unlikely.",['Strengths and weaknesses of study'],Discussion,['21']
48,PMC4770816S141,The trial represents a post-stroke primary care population managed by generalists rather than a selective hospital/outpatient population managed by specialists.,"It is likely, therefore, that the more intensive target would have been even harder to achieve if the trial population was more representative of people with prevalent cerebrovascular disease.","The outcome measure was not blinded, but a nurse not directly involved in the participant’s care obtained it by using an automated sphygmomanometer, so systematic recording bias is unlikely.",['Strengths and weaknesses of study'],Discussion,['21']
49,PMC4392313S86,"All other exploratory end points were summarised for the ITT population observed cases, without imputation of missing Data call receiving device and excluding escape data.",Only were escape before recorded therapy measurements carried forward.,"totally testing ground argument values were converted to SI units; for lipid parameters, only the latest fasted values inside the clock time windowpane were included.",['Statistical analysis'],Methods,['12b']
