,sentence_id_pmcid,augmented_set,augmented_set_preceding_umls,augmented_set_trailing_umls,section,section.1,CONSORT_Item
447,PMC5064025S88,"Two interim analyses were pre-specified, when n = 60 and all patients had completed 3 months of treatment, respectively, with the intention of halting the study if adverse measures were identified or for futility but not for interim positive efficacy.",Results are reported as means with 95% confidence limits.,The interim analyses were performed by independent personnel not directly associated with the study’s conduct.,['Statistical analyses'],Methods,['7b']
448,PMC5064025S89,The conduct. analyses not performed by independent personnel with study’s associated were the directly interim,"institute Two interim analyses constitute meanwhile were pre-specified, when n = 60 and all patients affected role had completed constitute 3 identify amount completely months of meanwhile treatment, respectively, with the dispatch intention of halting the study if adverse measures were identified or for futility but not for meanwhile interim positive efficacy.",The study sponsor and funder (Novartis) participated in discussions about the design and conduct of this study; they also provided the medicinal products Used by in the trial and logistical support for its execution.,['Statistical analyses'],Methods,['7b']
449,PMC5064025S89,The interim were by personnel not directly associated with study’s conduct.,"Two but analyses were the when study positive were all patients had completed 3 identified of months or with 60 interim interim halting the n = if adverse measures and treatment, respectively, for futility intention not for of pre-specified, efficacy.",logistic The study sponsor and funder (Novartis) participated logistical in discussions employ about the design field of operation logistic and conduct of doings logistic this study; field they also provided the drugs used in the trial astir and logistical support for its execution.,['Statistical analyses'],Methods,['7b']
450,PMC5064025S89,The meantime dissect were execute by independent personnel not like a shot associated with the study’s conduct.,"two meanwhile psychoanalyze were pre-specified, when n = lx and all patients had completed 3 months of treatment, respectively, with the aim of crippled the contemplate if untoward step were distinguish or for futility but not for meanwhile confident efficacy.",The study sponsor and funder (Novartis) of the drugs about its design and conduct participated study; discussions they in provided also this used in the trial and logistical support for the execution.,['Statistical analyses'],Methods,['7b']
451,PMC5064025S89,study’s associated The were performed by independent personnel not with interim directly the analyses conduct.,"Two analyses were when n = and all patients had completed 3 months of treatment, intention of halting study if measures identified or for futility but not for interim positive efficacy.",The contemplate sponsor and funder (Novartis) participated in discussions about the purpose and behave of this study; they as well furnish the drug habituate in the trial and logistic financial support for its execution.,['Statistical analyses'],Methods,['7b']
452,PMC5064025S89,The interim analyses were performed by Independently able personnel not directly associated with the study’s conduct.,"Two interim analyses were pre-specified, when n = 60 and all patients had completed 3 months of treatment, respectively, with the intent of halting the study if adverse measures were identified or for futility but not for interim rule efficacy.",The study sponsor and funder (Novartis) participated in discussions about the design and conduct of this study; they also provided the pharmaceutical preparation Used by in the trial and logistical support for its execution.,['Statistical analyses'],Methods,['7b']
453,PMC5064025S89,The interim analyses meantime relate were performed by independent relate personnel not directly relate associated with the study’s conduct.,"Two futility pre-specified, were analyses when n = for and all patients completed not or for of 3 positive with the intention of halting treatment, interim if adverse measures were identified the months interim but had 60 study respectively, efficacy.",The study sponsor and funder (Novartis) participated in discussions about the design and conduct of this study; they also provided the drug product used by in the trial and logistical support for its execution.,['Statistical analyses'],Methods,['7b']
454,PMC5064025S89,The interim analyses were performed by independent personnel not directly associated with the study’s conduct.,"Two interim analyses were pre-specified, when n = 60 and all patients had completed 3 months of treatment, respectively, with the intention of halting the study if adverse measures were identified or for futility but not for interim positive efficacy.",The study sponsor and funder (Novartis) participated in discussions about the design and conduct of this study; they also provided the drugs used in the trial and logistical support for its execution.,['Statistical analyses'],Methods,['7b']
455,PMC3386495S38,"At the end of the pilot film phase, since the briny stage liken treatment with open control, several additional measures were introduced to minimize prejudice in the judgement of early on and tardily outcomes.11",The initial pilot phase was double-blinded and placebo-controlled.,"We have published document report of the rationale for the trial,12 the protocol,13 an update on recruitment, amendments to the protocol and the baseline characteristics of the patients recruited,11 and the statistical analysis plan.14",['Study design and patients'],Methods,['3b']
456,PMC3386495S38,"last extra At the end of the pilot phase, since the main phase compared unfastened treatment with open early on control, several additional measures were introduced to tardy minimise bias in extra the enclose assessment of early on early form and late outcomes.11",The initial pilot phase was double-blinded phase angle and fly placebo-controlled.,"We have published Reported of the rationale for the trial,12 the protocol,13 an update on recruitment, amendments to the protocol and the baseline characteristics of the patients recruited,11 and the statistical analysis plan.14",['Study design and patients'],Methods,['3b']
457,PMC3386495S38,"At the end of the pilot phase, since the main phase compared Therapy with open control, several additional measures were introduced to minimise bias in the Knowledge acquisition using a method of assessment of early and late outcomes.11",pilot initial was phase The double-blinded and placebo-controlled.,"We have published of for trial,12 the protocol,13 on recruitment, amendments to the protocol and the baseline characteristics of patients recruited,11 plan.14",['Study design and patients'],Methods,['3b']
458,PMC3386495S38,"At the end of the pilot phase, since the main phase compared Therapeutic procedure with open control, several additional measures were introduced to minimise bias in the Knowledge acquisition using a method of assessment of early and late outcomes.11",The constitute fly initial pilot phase was double-blinded and placebo-controlled.,"We have print report card of the principle for the trial,12 the protocol,13 an update on recruitment, amendment to the communications protocol and the service line feature of the patient role recruited,11 and the statistical analytic thinking plan.14",['Study design and patients'],Methods,['3b']
459,PMC3386495S38,"At the end of the pilot phase, since the main phase compared Therapeutic with open control, several additional measures were introduced to minimise bias in the Knowledge acquisition using a method of assessment of early and late outcomes.11",The initial original form was double-blinded and placebo-controlled.,"We have published reports of rationale for the trial,12 the on recruitment, to the protocol and the baseline characteristics of the patients recruited,11 and statistical analysis",['Study design and patients'],Methods,['3b']
460,PMC3386495S38,"were treatment end early with pilot phase, since the main phase of to the open control, introduced additional measures At several late minimise bias in the assessment of compared and the outcomes.11",The initial phase pilot was and double-blinded placebo-controlled.,"We have amendments published of the rationale for the trial,12 the protocol,13 an the on to recruitment, of the reports and update baseline characteristics protocol the patients recruited,11 and the statistical analysis plan.14",['Study design and patients'],Methods,['3b']
461,PMC3386495S38,"At the end of the pilot phase, since the main phase compared treatment with open control, several additional measures were introduced to minimise bias in the assessment of early and late outcomes.11",The initial pilot phase was double-blinded and placebo-controlled.,"We have published reports of the rationale for the trial,12 the protocol,13 an update on recruitment, amendments to the protocol and the baseline characteristics of the patients recruited,11 and the statistical analysis plan.14",['Study design and patients'],Methods,['3b']
462,PMC3386495S92,"However, it was clear by 2007 that obtaining a sample of adenosine monophosphate evergreen state 6000 light was no longer feasible, and the nobelium Steering luminosity amp Committee agreed a revised information technology recruitment target.11","A trial of that size could Detected a clinically worthwhile net benefit of as little as 3% absolute difference in the primary outcome (80% power, α=0·05).","The sample size, re-estimated in 2007 on the basis of event rates in both treatment method groups combined, was 3100.","['Randomisation and masking', 'Statistical analysis']",Methods,['3b']
463,PMC3386495S92,"However, it was illuminate by 2007 that find a sampling of 6000 was no longer feasible, and the steer committee consort a revised enlisting target.11",A trial of could detect a worthwhile net benefit of little as 3% difference primary (80% α=0·05).,"The sample size, re-estimated in 2007 on the basis of event rates in both Therapeutic groups combined, was 3100.","['Randomisation and masking', 'Statistical analysis']",Methods,['3b']
464,PMC3386495S92,"However, it was clear by 2007 that obtaining a sample of 6000 was no longer feasible, and the Steering Committee agreed a revised Auditory recruitment target.11","A trial of net in that detect a clinically worthwhile could benefit α=0·05). as (80% primary 3% absolute difference size the as little outcome power, of","The on size, re-estimated combined, 2007 3100. the basis of sample rates in both in groups treatment was event","['Randomisation and masking', 'Statistical analysis']",Methods,['3b']
465,PMC3386495S92,"target.11 it was clear However, 2007 a obtaining a sample of 6000 was no recruitment feasible, Steering the and longer agreed that by Committee revised","A trial in as size could power, a clinically worthwhile benefit the of as little difference 3% absolute that of (80% primary outcome net detect α=0·05).","The sample size, re-estimated on in 2007 along make up on the along aggroup basis of event rates in both treatment groups combined, was 3100.","['Randomisation and masking', 'Statistical analysis']",Methods,['3b']
466,PMC3386495S92,"However, was clear by 2007 that obtaining sample of no longer and agreed revised recruitment target.11","A tribulation of that size could find a clinically worthwhile last do good of as trivial as 3% infrangible divergence in the primary outcome (80% power, α=0·05).","The sampling size, re-estimated in 2007 on the basis of outcome stag in both discourse aggroup combined, was 3100.","['Randomisation and masking', 'Statistical analysis']",Methods,['3b']
467,PMC3386495S92,"However, it was clear that obtaining a sample of was no longer feasible, and Steering agreed recruitment","find out A trial of that profits size could detect a clinically worthwhile conflict net benefit of as amp little do good as 3% absolute difference in the primary outcome find (80% profits power, α=0·05).","The sample size, inch re-estimated in 2007 footing pace on the basis of along event rates in both treatment discourse groups combined, was 3100.","['Randomisation and masking', 'Statistical analysis']",Methods,['3b']
468,PMC3386495S92,"However, it was clear by 2007 that obtaining a sample of 6000 was no longer feasible, and the Steering Committee agreed a revised recruitment target.11","A trial of that size could detect a clinically worthwhile net benefit of as little as 3% absolute difference in the primary outcome (80% power, α=0·05).","The sample size, re-estimated in 2007 on the basis of event rates in both treatment groups combined, was 3100.","['Randomisation and masking', 'Statistical analysis']",Methods,['3b']
469,PMC3386495S100,"The Independently able Data call receiving device monitoring committee met at least annually to reviewed the unmasked Data call receiving device on major outcome events in the trial, on the background stroke-unit In care received by trial patients (to ensure it was equal in both TREAT groups), relevant external Data call receiving device (including updates of the Cochrane reviews systematic and document report from large-scale Registry of Tissue Plasminogen Activator use) in strict Self Confidence throughout the course of the trial.","An expert radiologist cloak checked all scans, masked reception to clinical curb details an and treatment allocation, immediately reception on receipt at the trial office, for evidence run of adverse events and associate in nursing radiotherapist protocol deviations.",The committee judged these Data call receiving device never met the protocol-specified criteria to recommend modification of the protocol or halt Auditory recruitment to the study.,"['Randomisation and masking', 'Statistical analysis']",Methods,['7b']
470,PMC3386495S100,"received of data relevant committee it at unmasked annually to review the of data on (including trial. events in course trial, the the monitoring stroke-unit care The by trial reports (to ensure in was equal on both of groups), background external throughout major least treatment the Cochrane updates review and patients from large-scale registries independent rt-PA use) in strict confidence data the met systematic the outcome","An expert radiologist checked all scans, masked to clinical details and Therapies allocation, immediately on receipt at the trial office, for evidence of adverse experience and protocol deviations.",The committee protocol these to recruitment met the protocol-specified criteria data recommend modification study. the of or halt judged to the never,"['Randomisation and masking', 'Statistical analysis']",Methods,['7b']
471,PMC3386495S100,"fulfill The independent datum data monitoring issue committee met past at least annually to review study the past unmasked monitor data on major outcome bailiwick evergreen state events in the trial, on the background stroke-unit care received by trial patients (to ensure it was equal in both treatment groups), relevant upshot external data evergreen state (including information technology fulfill updates of the Cochrane john r major systematic review and reports from large-scale registries inch of rt-PA use) international in strict confidence throughout the course end to end information technology of aid the trial.","An scans, to clinical details and treatment allocation, at office, for evidence adverse protocol deviations.",The committee judged these information never met the protocol-specified criterion to advocate alteration of the communications protocol or halt enlisting to the study.,"['Randomisation and masking', 'Statistical analysis']",Methods,['7b']
472,PMC3386495S100,"The independent throughout monitoring course the at the annually to (to the unmasked care background major outcome events in confidence trial, least the on stroke-unit from on by trial patients review ensure the was equal in both treatment groups), of external data of met (including data Cochrane systematic review trial. reports updates relevant registries of rt-PA use) in strict received data it committee large-scale the and","An for radiologist checked all scans, masked to clinical details adverse treatment evidence immediately on trial expert the receipt office, at allocation, of and events and deviations. protocol",The committee judged these data never met the adjustment protocol-specified criteria adjustment to recommend commission beaver state modification of the protocol commission or halt recruitment commission to the study.,"['Randomisation and masking', 'Statistical analysis']",Methods,['7b']
473,PMC3386495S100,"The Independently able Data call receiving device monitoring committee met at least annually to reviewing the unmasked Data call receiving device on major outcome events in the trial, on the background stroke-unit care performed in residence received by trial patients (to ensure it was equal in both therapeutic method groups), relevant external Data call receiving device (including updates of the Cochrane reviewing systematic and Reported from large-scale registry of tPA use) in strict self confidence throughout the course of the trial.","An expert radiologist checked all scans, masked to clinical details and Therapy allocation, immediately on receipt at the trial office, for evidence of Adverse Experience and protocol deviations.",The committee data never met the criteria modification the protocol or halt to the study.,"['Randomisation and masking', 'Statistical analysis']",Methods,['7b']
474,PMC3386495S100,"The Independently able Data call receiving device monitoring committee met at least annually to reviewing the unmasked Data call receiving device on major outcome events in the trial, on the background stroke-unit In care received by trial patients (to ensure it was equal in both Therapeutics groups), relevant external Data call receiving device (including updates of the Cochrane reviewing systematic and document report from large-scale Registry of T Plasminogen Activator use) in strict Self Confidence throughout the course of the trial.","contingent An expert communications protocol radiologist checked all completely grounds curb scans, masked to clinical details and treatment allocation, immediately on receipt radiotherapist at the trial office, for evidence of adverse wholly cloak events and protocol deviations.",The committee judged lame these data never met the protocol-specified criteria to recommend enlisting modification beaver state of urge the protocol or halt recruitment to barrack commission the study.,"['Randomisation and masking', 'Statistical analysis']",Methods,['7b']
475,PMC3386495S100,"The independent data monitoring committee met at least annually to review the unmasked data on major outcome events in the trial, on the background stroke-unit care received by trial patients (to ensure it was equal in both treatment groups), relevant external data (including updates of the Cochrane systematic review and reports from large-scale registries of rt-PA use) in strict confidence throughout the course of the trial.","An expert radiologist checked all scans, masked to clinical details and treatment allocation, immediately on receipt at the trial office, for evidence of adverse events and protocol deviations.",The committee judged these data never met the protocol-specified criteria to recommend modification of the protocol or halt recruitment to the study.,"['Randomisation and masking', 'Statistical analysis']",Methods,['7b']
476,PMC3386495S101,The committee judged these information never touch the protocol-specified criteria to commend modification of the communications protocol or block enlisting to the study.,The independent data monitoring committee met at least annually to the unmasked on major events the on background care received (to was treatment relevant external data (including updates of the Cochrane systematic review of rt-PA in confidence throughout course the trial.,The statistical published14 before unmasking of the authors to the,"['Randomisation and masking', 'Statistical analysis']",Methods,['7b']
477,PMC3386495S101,The committee judged these Data call receiving device never met the protocol-specified criteria to recommend modification of the protocol or halt Auditory recruitment to the study.,"The Independently able Data call receiving device monitoring committee met at least annually to Review [Publication Type] the unmasked Data call receiving device on major outcome events in the trial, on the background stroke-unit in care received by trial patients (to ensure it was equal in both Therapeutic Interventions groups), relevant external Data call receiving device (including updates of the Cochrane reviews systematic and report [document] from large-scale Registry of Plasminogen activator tissue type use) in strict self confidence throughout the course of the trial.",The statistical analysis plan was published14 before unmasking of authors to the data.,"['Randomisation and masking', 'Statistical analysis']",Methods,['7b']
478,PMC3386495S101,The committee to these to never met the protocol-specified criteria data recommend of modification the protocol or halt recruitment the judged study.,"The Independently able Data call receiving device monitoring committee met at least annually to Review [Publication Type] the unmasked Data call receiving device on major outcome events in the trial, on the background stroke-unit care performed in residence received by trial patients (to ensure it was equal in both therapeutic method groups), relevant external Data call receiving device (including updates of the Cochrane Review [Publication Type] systematic and report [document] from large-scale Registry of Activase use) in strict self confidence throughout the course of the trial.",The statistical psychoanalysis contrive was published14 before unmask of the generator to the data.,"['Randomisation and masking', 'Statistical analysis']",Methods,['7b']
479,PMC3386495S101,The these met protocol-specified criteria to recommend modification of protocol or recruitment to the study.,"the The to monitoring data independent at least annually data unmasked the review the the course from events the in trial, on met background stroke-unit care received of trial it (to ensure confidence was equal groups), both treatment in relevant external data (including outcome of on Cochrane systematic review and reports by large-scale registries trial. rt-PA in use) strict patients throughout the major of committee updates",The statistical psychoanalysis program was published14 before unmask of the source to the data.,"['Randomisation and masking', 'Statistical analysis']",Methods,['7b']
480,PMC3386495S101,The committee judged these data never the criteria recommend of the halt,"The Independently able Data call receiving device monitoring committee met at least annually to reviewed the unmasked Data call receiving device on major outcome events in the trial, on the background stroke-unit In care received by trial patients (to ensure it was equal in both Therapeutic Procedure groups), relevant external Data call receiving device (including updates of the Cochrane reviews systematic and report [document] from large-scale registry of T Plasminogen Activator use) in strict self confidence throughout the course of the trial.",The before the plan was published14 statistical unmasking of analysis to authors the data.,"['Randomisation and masking', 'Statistical analysis']",Methods,['7b']
481,PMC3386495S101,The lame committee judged these communications protocol data never enlisting met the protocol-specified criteria to datum neer recommend modification of the protocol or halt recruitment to the beaver state study.,"The Independently able Data call receiving device monitoring committee met at least annually to Review [Publication Type] the unmasked Data call receiving device on major outcome events in the trial, on the background stroke-unit care provided in residence received by trial patients (to ensure it was equal in both therapeutic intervention groups), relevant external Data call receiving device (including updates of the Cochrane Review [Publication Type] systematic and report [document] from large-scale registry of Activase use) in strict self confidence throughout the course of the trial.",The statistical analysis plan was published14 before unmasking of the authors to the data.,"['Randomisation and masking', 'Statistical analysis']",Methods,['7b']
482,PMC3386495S101,The committee judged these data never met the protocol-specified criteria to recommend modification of the protocol or halt recruitment to the study.,"The independent data monitoring committee met at least annually to review the unmasked data on major outcome events in the trial, on the background stroke-unit care received by trial patients (to ensure it was equal in both treatment groups), relevant external data (including updates of the Cochrane systematic review and reports from large-scale registries of rt-PA use) in strict confidence throughout the course of the trial.",The statistical analysis plan was published14 before unmasking of the authors to the data.,"['Randomisation and masking', 'Statistical analysis']",Methods,['7b']
