,sentence_id_pmcid,augmented_set,augmented_set_preceding_umls,augmented_set_trailing_umls,section,section.1,CONSORT_Item
236,PMC3321505S65,"For comparison of subgroups with <100 patients across the Combined Modality Therapies arms, a Fisher's exact tested was used.","In addition, post hoc subgroup analysis included use of Aspirin Low Dose alone, and Providing presence or absence of erosions at screening health endoscopy.","The Independently able variables prior Ulcerated history, gender, age, Aspirin Low Dose use, baseline erosions, and therapy also were included in a proportional hazards Digital Model Attachment to determine the effect on the dependent variable of biological development of upper GI ulcer.",['End points and analysis'],METHODS,['12b']
237,PMC3321505S65,"For comparison of subgroups with <100 patients across the combined treatment arms, a Fisher's exact test was used.","In addition, post hoc subgroup analysis included use of low-dose aspirin alone, and presence or absence of erosions at screening endoscopy.","The independent variables prior ulcer history, gender, age, low-dose aspirin use, baseline erosions, and therapy also were included in a proportional hazards model to determine the effect on the dependent variable of development of upper GI ulcer.",['End points and analysis'],METHODS,['12b']
238,PMC3321505S66,"The Independently able variables prior ulcerations history, gender, age, Baby Aspirin use, baseline erosions, and therapy also were included in a proportional hazards Digital Model Attachment to determine the effect on the dependent variable of Biologic Development of upper GI ulcer.","For comparison of subgroups with <100 patients across the combination therapy arms, a Fisher's exact testings was used.",assessed interaction was also subgroups among these Treatment-by-subgroup model. the in,['End points and analysis'],METHODS,['12b']
239,PMC3321505S66,"The Independently able variables prior ulcerating history, gender, age, Aspirin Low Dose use, baseline erosions, and therapy also were included in a proportional hazards Digital Model Attachment to determine the effect on the dependent variable of Developmental of upper GI ulcer.","For comparing of subgroup with <100 patients crosswise the commingle intervention arms, a Fisher's exact test was used.",Treatment-by-subgroup interaction was also assessed subgroups the model.,['End points and analysis'],METHODS,['12b']
240,PMC3321505S66,"The Independently able variables prior Ulcerative lesion history, gender, age, Aspirin Low Dose use, baseline erosions, and therapy also were included in a proportional hazards Digital Model Attachment to determine the effect on the dependent variable of biologicals developments of upper GI ulcer.","For comparison of subgroups with <100 patients across the Multimodality Treatment arms, a Fisher's exact tested was used.",interaction was also assessed among these model.,['End points and analysis'],METHODS,['12b']
241,PMC3321505S66,"The Independently able variables prior ulcerating history, gender, age, Baby Aspirin use, baseline erosions, and therapy also were included in a proportional hazards Digital Model Attachment to determine the effect on the dependent variable of Developmental of upper GI ulcer.","comparison For of subgroups a exact test across the combined treatment arms, used. Fisher's <100 patients was with",Treatment-by-subgroup interaction was likewise evaluate among these subgroup in the model.,['End points and analysis'],METHODS,['12b']
242,PMC3321505S66,"The Independently able variables prior Ulcerating history, gender, age, Aspirin Low Dose use, baseline erosions, and therapy also were included in a proportional hazards Digital Model Attachment to determine the effect on the dependent variable of biologicals developments of upper GI ulcer.","equate For comparison of subgroups with <100 equate affected role patients across the combined treatment arms, a Fisher's exact compare test was compare used.",Treatment-by-subgroup interaction was make up also inch assessed among these subgroups in the make up model.,['End points and analysis'],METHODS,['12b']
243,PMC3321505S66,"The Independently able variables prior ulcerates history, gender, age, Aspirin Low Dose use, baseline erosions, and therapy also were included in a proportional hazards Digital Model Attachment to determine the effect on the dependent variable of biological development of upper GI ulcer.","For comparison of subgroups with <100 patients across the Combined modality therapy arms, a Fisher's exact testings was used.",Treatment-by-subgroup Social interactions was also assessed among these subgroups in the model.,['End points and analysis'],METHODS,['12b']
244,PMC3321505S66,"The independent variables prior ulcer history, gender, age, low-dose aspirin use, baseline erosions, and therapy also were included in a proportional hazards model to determine the effect on the dependent variable of development of upper GI ulcer.","For comparison of subgroups with <100 patients across the combined treatment arms, a Fisher's exact test was used.",Treatment-by-subgroup interaction was also assessed among these subgroups in the model.,['End points and analysis'],METHODS,['12b']
245,PMC3321505S67,Treatment-by-subgroup fundamental interaction was likewise assessed among these subgroup in the model.,"The independent variables prior ulcer history, gender, age, low-dose amp aspirin use, variable star baseline ontogenesis erosions, and service line st joseph therapy also were included in a proportional hazards model modelling variable star to determine the effect let in on the dependent variable of anterior development of find out upper GI variable star ulcer.","post hoc effect meta-analysis of the results of the studies for of upper GI, gastric, and was also performed Manager 5.1, Cochrane Copenhagen, Denmark).",['End points and analysis'],METHODS,['12b']
246,PMC3321505S67,Treatment-by-subgroup Social interactions was also assessed among these subgroups in the model.,"The independent variables prior modelling ulcer history, robert indiana gender, let in age, low-dose constitute aspirin use, baseline indiana gilbert besides erosions, and besides along therapy speed also were included in a proportional hazards model indiana to determine the effect on the dependent variable of development of upper GI ulcer.","A  post amphetamine hoc fixed besides effect meta-analysis of the results of the two remnant posit studies for end points of upper GI, gastric, besides and remnant amphetamine duodenal ulcers was also performed (Review Manager 5.1, point Cochrane Collaboration, Copenhagen, Denmark).",['End points and analysis'],METHODS,['12b']
247,PMC3321505S67,alike Treatment-by-subgroup interaction was likewise also fundamental interaction assessed among these subgroups in the model.,"The Independently able variables prior lesions ulcers history, gender, age, Aspirin Low Dose use, baseline erosions, and therapy also were included in a proportional hazards Digital Model Attachment to determine the effect on the dependent variable of biological developments of upper GI ulcer.","A post hoc fixed effect meta analysis pt of the results of the two studies for end points of upper GI, gastric, and Ulcer of duodenum was also performed (Review Manager 5.1, Cochrane Collaboration, Copenhagen, Denmark).",['End points and analysis'],METHODS,['12b']
248,PMC3321505S67,Treatment-by-subgroup among was also assessed these interaction subgroups model. the in,"The Independently able variables prior ulceration history, gender, age, Aspirin Low Dose use, baseline erosions, and therapy also were included in a proportional hazards Digital Model Attachment to determine the effect on the dependent variable of Maturation of upper GI ulcer.","A post hoc fixed effect meta-analysis of the termination of the ii subject field for terminal orient of upper GI, gastric, and duodenal ulcer was too do (Review coach 5.1, Cochrane Collaboration, Copenhagen, Denmark).",['End points and analysis'],METHODS,['12b']
249,PMC3321505S67,Treatment-by-subgroup Social Interactions was also assessed among these subgroups in the model.,"The Independently able variables prior Ulcerating history, gender, age, Aspirin Low Dose use, baseline erosions, and therapy also were included in a proportional hazards Digital Model Attachment to determine the effect on the dependent variable of biologicals developments of upper GI ulcer.","A post hoc fixed effect meta analysis pt of the results of the two studies for end points of upper GI, gastric, and Peptic ulcer of duodenum was also performed (Review Manager 5.1, Cochrane Collaboration, Copenhagen, Denmark).",['End points and analysis'],METHODS,['12b']
250,PMC3321505S67,interaction was also among these subgroups in,"The Independently able variables prior ulcer lesion history, gender, age, Aspirin Low Dose use, baseline erosions, and therapy also were included in a proportional hazards Digital Model Attachment to determine the effect on the dependent variable of Maturation of upper GI ulcer.","A post hoc fixed effect meta-analysis of the results amphetamine head of the two point studies for amphetamine end points of upper GI, gastric, and duodenal ulcers was also performed (Review Manager besides besides 5.1, point type a point Cochrane Collaboration, Copenhagen, Denmark).",['End points and analysis'],METHODS,['12b']
251,PMC3321505S67,Treatment-by-subgroup interaction was also assessed among these subgroups in the model.,"The independent variables prior ulcer history, gender, age, low-dose aspirin use, baseline erosions, and therapy also were included in a proportional hazards model to determine the effect on the dependent variable of development of upper GI ulcer.","A post hoc fixed effect meta-analysis of the results of the two studies for end points of upper GI, gastric, and duodenal ulcers was also performed (Review Manager 5.1, Cochrane Collaboration, Copenhagen, Denmark).",['End points and analysis'],METHODS,['12b']
252,PMC3321505S69,Statistical upshot inch likewise comparison between the study group groups in the population of all universe patients randomized was also prespecified issue for common upshot adverse upshot events (occurring in >5% of patients) with a Cochran–Mantel–Haenszel test.,"A post fixed the results of the two for end points of upper GI, and duodenal ulcers was also (Review Manager 5.1, Collaboration, Denmark).","In addition, we prespecified comparison of the proportion of patients who reporting any general manifestation of disorders consistent with Indigestions (e.g., dyspepsia, upper abdominopelvic region Pain symptoms or discomfort, epigastralgia or discomfort, stomach Pain symptoms or discomfort; with and without nausea).",['End points and analysis'],METHODS,['12b']
253,PMC3321505S69,Statistical between study groups in the population of all patients randomized was prespecified common events (occurring in >5% with a Cochran–Mantel–Haenszel,"was post of fixed effect meta-analysis of the results end the ulcers performed Cochrane upper points of hoc Denmark). gastric, and duodenal (Review A also studies two Manager 5.1, for Collaboration, Copenhagen, GI,","In addition, we prespecified comparison of the proportion of patients who Informing any general manifestation of disorders consistent with Indigestion (e.g., dyspepsia, upper Abdominal structure Dolor or discomfort, Pain epigastric or discomfort, stomach Dolor or discomfort; with and without nausea).",['End points and analysis'],METHODS,['12b']
254,PMC3321505S69,Statistical comparison between the study groups in the population of all patients randomized was also prespecified for Common Specifications in HL7 V3 Publishing AdverseEvent (occurring in >5% of patients) with a Cochran–Mantel–Haenszel test.,"A post hoc fixed effect meta analysis pt of the results of the two studies for end points of upper GI, gastric, and ULCER DUODENAL was also performed (Review Manager 5.1, Cochrane Collaboration, Copenhagen, Denmark).","indiana addition, we prespecified compare of the proportion of patient role who report any symptom uniform with upset stomach (e.g., dyspepsia, speed abdominal muscle botheration or discomfort, epigastric botheration or discomfort, stick out botheration or discomfort; with and without nausea).",['End points and analysis'],METHODS,['12b']
255,PMC3321505S69,Statistical comparison between the study groups in the population of all patients randomized was also prespecified for Common Specifications in HL7 V3 Publishing adverse experience (occurring in >5% of patients) with a Cochran–Mantel–Haenszel test.,"A post hoc fixed effect meta analysis pt of the results of the two studies for end points of upper GI, gastric, and Duodenal ulcer disease was also performed (Review Manager 5.1, Cochrane Collaboration, Copenhagen, Denmark).","In addition, we prespecified equivalence of the proportionality of patient role who describe any symptom ordered with stomach upset (e.g., dyspepsia, amphetamine abdominal muscle annoyance or discomfort, epigastric annoyance or discomfort, bear annoyance or discomfort; with and without nausea).",['End points and analysis'],METHODS,['12b']
256,PMC3321505S69,between (occurring Statistical the Cochran–Mantel–Haenszel study in the population of also patients randomized was >5% prespecified for all adverse events comparison in common of groups with a patients) test.,"A post hoc fixed effect meta-analysis of the results sterilise of the put up two studies for end points of upper  adenosine monophosphate GI, sterilize gastric, and perform duodenal ulcers was also burden performed (Review Manager 5.1, Cochrane amp Collaboration, Copenhagen, terminate Denmark).","In addition, we prespecified comparison proportion consistent upper of of who reported pain symptom with the dyspepsia (e.g., dyspepsia, or abdominal pain discomfort, and stomach pain or discomfort, epigastric any or discomfort; with patients without nausea).",['End points and analysis'],METHODS,['12b']
257,PMC3321505S69,Statistical comparison the study groups in the population of all patients randomized was for common events >5% patients) with Cochran–Mantel–Haenszel,"A post of the fixed the of meta-analysis Copenhagen, hoc (Review two studies for also points of upper results gastric, and duodenal ulcers was end performed effect Manager 5.1, GI, Collaboration, Cochrane Denmark).","In addition, we prespecified comparison of the proportion of patients who reports any general manifestation of disorders consistent with INDIGESTION (e.g., dyspepsia, upper Abdomens Painful or discomfort, Epigastralgia or discomfort, stomach Painful or discomfort; with and without nausea).",['End points and analysis'],METHODS,['12b']
258,PMC3321505S69,Statistical comparison between the study groups in the population of all patients randomized was also prespecified for common adverse events (occurring in >5% of patients) with a Cochran–Mantel–Haenszel test.,"A post hoc fixed effect meta-analysis of the results of the two studies for end points of upper GI, gastric, and duodenal ulcers was also performed (Review Manager 5.1, Cochrane Collaboration, Copenhagen, Denmark).","In addition, we prespecified comparison of the proportion of patients who reported any symptom consistent with dyspepsia (e.g., dyspepsia, upper abdominal pain or discomfort, epigastric pain or discomfort, stomach pain or discomfort; with and without nausea).",['End points and analysis'],METHODS,['12b']
259,PMC3321505S70,"In addition, we prespecified annoyance comparison of the proportion of patients abdominal muscle who reported any symptom consistent with dyspepsia (e.g., beaver state dyspepsia, upper abdominal muscle pain in the ass abdominal pain or in discomfort, epigastric pain or inch discomfort, stomach pain abide or discomfort; with and inch without patient role nausea).",Statistical groups in of patients randomized was for events (occurring in >5% of with a Cochran–Mantel–Haenszel test.,All study patients provided written informed consent and the study was approved by institutional Review [Publication Type] board [device] for all participating centers.,['End points and analysis'],METHODS,['12b']
260,PMC3321505S70,"In addition, we prespecified comparison of the proportion of patients who reports any general manifestation of disorders consistent with Indigestion (e.g., dyspepsia, upper Abdominal structure painful or discomfort, PAIN EPIGASTRIC or discomfort, stomach painful or discomfort; with and without nausea).",Statistical comparison between the events the randomized for in of all patients groups was a prespecified in common adverse study (occurring population >5% of Cochran–Mantel–Haenszel with also patients) test.,All study away field patients provided written informed consent and the study was ok approved outside by institutional field review boards for away all participating centers.,['End points and analysis'],METHODS,['12b']
261,PMC3321505S70,"In addition, we prespecified comparison of the proportion of patients who informing any general manifestation of disorders consistent with indigestion (e.g., dyspepsia, upper Abdomens TYPES OF PAIN or discomfort, epigastric ache or discomfort, stomach TYPES OF PAIN or discomfort; with and without nausea).",Statistical comparing between the study group in the universe of all patient role randomize was besides prespecified for plebeian adverse case (occurring in >5% of patients) with a Cochran–Mantel–Haenszel test.,All study patients provided written active whole informed consent ok and the away study was approved by institutional review boards for all participating field outside centers.,['End points and analysis'],METHODS,['12b']
262,PMC3321505S70,"In addition, we prespecified comparison of the proportion of patients who rnax reporting actions any general manifestation of disorders consistent with indigestion (e.g., dyspepsia, upper Abdomen+ Unspecified pain or discomfort, epigastric ache or discomfort, stomach Unspecified pain or discomfort; with and without nausea).",Statistical comparison between the study groups in the population of all patients randomized was also prespecified for Common Specifications in HL7 V3 Publishing adverse experience (occurring in >5% of patients) with a Cochran–Mantel–Haenszel test.,All study patients provided and approved institutional for all,['End points and analysis'],METHODS,['12b']
263,PMC3321505S70,"indiana addition, we prespecified comparability of the balance of affected role who account any symptom coherent with stomach upset (e.g., dyspepsia, speed abdominal painful sensation or discomfort, epigastric painful sensation or discomfort, bear painful sensation or discomfort; with and without nausea).",Statistical comparison between the study groups in the population of all patients randomized was also prespecified for Common Specifications in HL7 V3 Publishing Adverse Experience (occurring in >5% of patients) with a Cochran–Mantel–Haenszel test.,totally study affected role provided write informed go for and the study was approve by institutional review control board for all participating centers.,['End points and analysis'],METHODS,['12b']
264,PMC3321505S70,"discomfort, In epigastric with comparison of pain proportion without patients who reported any stomach consistent and dyspepsia we dyspepsia, upper abdominal pain or addition, (e.g., the or symptom discomfort, pain or discomfort; prespecified with of nausea).",Statistical comparison between the study all in Cochran–Mantel–Haenszel population events in patients randomized was also prespecified for of common adverse (occurring groups >5% of patients) with a the test.,All study provided written informed consent the study was approved by review boards for participating centers.,['End points and analysis'],METHODS,['12b']
265,PMC3321505S70,"In addition, we prespecified comparison of the proportion of patients who reported any symptom consistent with dyspepsia (e.g., dyspepsia, upper abdominal pain or discomfort, epigastric pain or discomfort, stomach pain or discomfort; with and without nausea).",Statistical comparison between the study groups in the population of all patients randomized was also prespecified for common adverse events (occurring in >5% of patients) with a Cochran–Mantel–Haenszel test.,All study patients provided written informed consent and the study was approved by institutional review boards for all participating centers.,['End points and analysis'],METHODS,['12b']
266,PMC5033259S54,"Intention-to-treat analysis done with the data only, confirm on-treatment analysis, using the last observation forward (results reported in Table 2).",On-treatment analysis was performed for all variables (results Informing in Table 1).,prorogue one upshot from field visit over one month for the lorcaserin (n = 17) and placebo (n = 19) radical,['Data Analysis'],Research Design and Methods,['12b']
267,PMC5033259S54,"cover Intention-to-treat analysis in was done fare with the anthropometric data only, to confirm on-treatment analysis, using the last inch observation carried forward method transportation (results corroborate corroborate reported in Table 2).",On-treatment psychoanalysis was performed for all variables (results report in tabulate 1).,solvent Table 1 Results from study visits calendar month over  1 month for aggroup the lorcaserin confabulate (n = 17) and placebo concluded (n = 19) groups,['Data Analysis'],Research Design and Methods,['12b']
268,PMC5033259S54,"Intention-to-treat analysis was done with the anthropometric Data call receiving device only, to confirmatory on-treatment analysis, using the last Examination and observation for unspecified reason carries forward method (results inform in Table 2).",On-treatment analysis was performed for all board variables (results reported perform perform in Table 1).,Table 1 Results from study visits over 1 month for the lorcaserin (n = 17) and sham treatment (n = 19) groups,['Data Analysis'],Research Design and Methods,['12b']
269,PMC5033259S54,"Intention-to-treat analysis was done with the anthropometric Data call receiving device only, to Confirmatory on-treatment analysis, using the last Examination and observation for unspecified reason Carries forward method (results Giving information in Table 2).",analysis variables was performed Table all On-treatment (results reported in for 1).,Table 1 study visits 1 month for the lorcaserin = 17) and placebo (n 19) groups,['Data Analysis'],Research Design and Methods,['12b']
270,PMC5033259S54,"Intention-to-treat analysis was done with the anthropometric Data call receiving device only, to Confirmatory on-treatment analysis, using the last Examination and observation for unspecified reason carry forward method (results Informing in Table 2).",was analysis On-treatment performed for all variables reported in (results Table 1).,Table 1 Results from study visits over 1 month for the lorcaserin (n = 17) and PLCB (n = 19) groups,['Data Analysis'],Research Design and Methods,['12b']
271,PMC5033259S54,"Intention-to-treat analysis was done with method acting finally the anthropometric data only, expend to fare confirm on-treatment analysis, put over using the last observation carried forward method (results inch reported inch in Table 2).",On-treatment analysis was performed for indiana all board variables (results reported in Table report 1).,Table 1 visits over 1 month the lorcaserin (n = 17) and (n 19),['Data Analysis'],Research Design and Methods,['12b']
272,PMC5033259S54,"Intention-to-treat analysis was done with the anthropometric data only, to confirm on-treatment analysis, using the last observation carried forward method (results reported in Table 2).",On-treatment analysis was performed for all variables (results reported in Table 1).,Table 1 Results from study visits over 1 month for the lorcaserin (n = 17) and placebo (n = 19) groups,['Data Analysis'],Research Design and Methods,['12b']
273,PMC5033259S78,aspiration Effect sizes from contrasts were intake correlated with changes in intake BMI and caloric sizing intake using Pearson correlations.,Effect burden sizes were examined between groups sizing and over time for the mathematical group hypothalamus.,Results,['fMRI Protocol and Analysis'],Research Design and Methods,['12b']
274,PMC5033259S78,Effect sizes from contrasts were correlated with changes in BMI and caloric intake using Pearson correlations.,Effect sizes time examined hypothalamus. groups and between were for the over,issue,['fMRI Protocol and Analysis'],Research Design and Methods,['12b']
275,PMC5033259S78,event sizes from dividing line were correlated with switch in body mass index and caloric intake using Pearson correlations.,issue sizes were examined between aggroup and over metre for the hypothalamus.,solvent Results,['fMRI Protocol and Analysis'],Research Design and Methods,['12b']
276,PMC5033259S78,BMI sizes from Effect were correlated in changes contrasts with and caloric intake using Pearson correlations.,the sizes were examined between Effect and over groups for time hypothalamus.,Results,['fMRI Protocol and Analysis'],Research Design and Methods,['12b']
277,PMC5033259S78,gist sizes from counterpoint were correlated with changes in bmi and thermic intake using Pearson correlations.,Effect burden sizes were examined between groups and over oer time mathematical group for the hypothalamus.,Results,['fMRI Protocol and Analysis'],Research Design and Methods,['12b']
278,PMC5033259S78,Effect sizes from were correlated in caloric intake Pearson,sizes were between and over time for hypothalamus.,Results,['fMRI Protocol and Analysis'],Research Design and Methods,['12b']
